<?xml version="1.0" encoding="UTF-8"?>
<user xmlns="http://www.hua.com"
	xmlns:xsi="http://www.w3.org/2001/XMLSchema-instance"
	xsi:schemaLocation="http://www.hua.com/user D:/data/xsd/com/hua/user.xsd">
	<id>20150628</id>
	<username>张三</username>
	<nickname>少年张三丰</nickname>
	<password>123456</password>
	<valid>true</valid>
	<lastLoginTime>2015-07-13 16:31:09</lastLoginTime>
	<lastLoginIp>192.168.5.66</lastLoginIp>
</user>
